{
  "$schema": "./template.schema.json",
  "id": "public-app-react-vite-template/v1",
  "version": "1.0.0",
  "lifecycle": "scaffold-only",
  "referenceApp": "cloud-post",
  "packageManager": "pnpm@11.9.0",
  "node": "24",
  "runtime": {
    "react": "19.2.8",
    "reactDom": "19.2.8"
  },
  "build": {
    "vite": "8.1.5",
    "typescript": "7.0.2"
  },
  "optionalRecipes": [
    "react-aria"
  ]
}
